{
  "schemaVersion": 1,
  "kind": "process-tap-tcc-denial",
  "spikeID": "SPIKE-CAP-001",
  "runID": "00000000-0000-4000-8000-000000000002",
  "generatedAt": "2026-07-24T08:00:00Z",
  "osVersion": "fixture",
  "hardwareArchitecture": "arm64",
  "probeBundleIdentifier": "com.bestasr.spike.process-tap-tcc-denial-probe.v2",
  "status": "pass",
  "denialObserved": true,
  "operatorConfirmedDenial": true,
  "tapCreated": true,
  "createTapStatus": 0,
  "captureStarted": true,
  "startCaptureStatus": 0,
  "callbackCount": 100,
  "frameCount": 48000,
  "capturedRMS": 0,
  "capturedWatermarkAmplitude": 0,
  "watermarkDetected": false,
  "audioContentSuppressed": true,
  "tapCountBefore": 2,
  "tapCountAfter": 2,
  "aggregateDeviceCountBefore": 1,
  "aggregateDeviceCountAfter": 1,
  "syntheticSourceOnly": true,
  "sourceAudioPersisted": false,
  "failureCategory": "tcc-denied-audio-content-suppressed"
}
